{
    "name": "BelBen",
    "max_time": 100000,
    "nodes": [
        {
            "label": "1",
            "position": [
                10,
                50
            ]
        },
        {
            "label": "2",
            "position": [
                20,
                90
            ]
        },
        {
            "label": "3",
            "position": [
                20,
                60
            ]
        },
        {
            "label": "4",
            "position": [
                20,
                40
            ]
        },
        {
            "label": "5",
            "position": [
                20,
                10
            ]
        },
        {
            "label": "6",
            "position": [
                30,
                60
            ]
        },
        {
            "label": "7",
            "position": [
                30,
                40
            ]
        }
    ],
    "vehicles": [
        {
            "id": "1",
            "home": "1",
            "capacity": 25.0
        },
        {
            "id": "2",
            "home": "1",
            "capacity": 25.0
        }
    ],
    "depots": [{"label": "1", "refill": 25.0}],
    "A": [
        {
            "arc": [
                "4",
                "7"
            ],
            "time": 0,
            "len": 1
        },
        {
            "arc": [
                "7",
                "4"
            ],
            "time": 0,
            "len": 1
        }
    ],
    "A_R": [],
    "E_R": [
        {
            "edge": [
                "1",
                "2"
            ],
            "time": 0,
            "len": 1,
            "dem": 3
        },
        {
            "edge": [
                "1",
                "3"
            ],
            "time": 0,
            "len": 1,
            "dem": 4
        },
        {
            "edge": [
                "1",
                "4"
            ],
            "time": 0,
            "len": 1,
            "dem": 4
        },
        {
            "edge": [
                "1",
                "5"
            ],
            "time": 0,
            "len": 1,
            "dem": 3
        },
        {
            "edge": [
                "2",
                "3"
            ],
            "time": 0,
            "len": 1,
            "dem": 1
        },
        {
            "edge": [
                "3",
                "4"
            ],
            "time": 0,
            "len": 1,
            "dem": 1
        },
        {
            "edge": [
                "3",
                "6"
            ],
            "time": 0,
            "len": 1,
            "dem": 5
        },
        {
            "edge": [
                "4",
                "5"
            ],
            "time": 0,
            "len": 1,
            "dem": 1
        },
        {
            "edge": [
                "6",
                "7"
            ],
            "time": 0,
            "len": 1,
            "dem": 14
        }
    ],
    "U": []
}
