{
    "name": "Gualandi",
    "max_time": 100000,
    "nodes": [
        {
            "label": "0",
            "position": [
                0,
                12
            ]
        },
        {
            "label": "1",
            "position": [
                4,
                8
            ]
        },
        {
            "label": "2",
            "position": [
                12,
                8
            ]
        },
        {
            "label": "3",
            "position": [
                4,
                3
            ]
        },
        {
            "label": "4",
            "position": [
                12,
                3
            ]
        },
        {
            "label": "5",
            "position": [
                17,
                12
            ]
        },
        {
            "label": "6",
            "position": [
                17,
                17
            ]
        },
        {
            "label": "7",
            "position": [
                20,
                3
            ]
        }
    ],
    "vehicles": [
        {
            "id": "1",
            "home": "0",
            "capacity": 50.0
        }
    ],
    "depots": [
        {
            "label": "7",
            "refill": 50.0
        }
    ],
    "A": [
        {
            "arc": [
                "0",
                "1"
            ],
            "time": 0,
            "len": 6
        },
        {
            "arc": [
                "2",
                "3"
            ],
            "time": 0,
            "len": 10
        },
        {
            "arc": [
                "2",
                "4"
            ],
            "time": 0,
            "len": 5
        },
        {
            "arc": [
                "2",
                "5"
            ],
            "time": 0,
            "len": 7
        },
        {
            "arc": [
                "1",
                "3"
            ],
            "time": 0,
            "len": 5
        },
        {
            "arc": [
                "4",
                "7"
            ],
            "time": 0,
            "len": 8
        },
        {
            "arc": [
                "5",
                "7"
            ],
            "time": 0,
            "len": 10
        },
        {
            "arc": [
                "1",
                "0"
            ],
            "time": 0,
            "len": 6
        },
        {
            "arc": [
                "3",
                "2"
            ],
            "time": 0,
            "len": 10
        },
        {
            "arc": [
                "4",
                "2"
            ],
            "time": 0,
            "len": 5
        },
        {
            "arc": [
                "5",
                "2"
            ],
            "time": 0,
            "len": 7
        },
        {
            "arc": [
                "3",
                "1"
            ],
            "time": 0,
            "len": 5
        },
        {
            "arc": [
                "7",
                "4"
            ],
            "time": 0,
            "len": 8
        },
        {
            "arc": [
                "7",
                "5"
            ],
            "time": 0,
            "len": 10
        },
        {
            "arc": [
                "5",
                "6"
            ],
            "time": 0,
            "len": 5
        },
        {
            "arc": [
                "4",
                "3"
            ],
            "time": 0,
            "len": 8
        }
    ],
    "A_R": [
        {
            "arc": [
                "3",
                "4"
            ],
            "time": 0,
            "len": 8,
            "dem": 20
        },
        {
            "arc": [
                "6",
                "5"
            ],
            "time": 0,
            "len": 5,
            "dem": 30
        }
    ],
    "E_R": [
        {
            "edge": [
                "1",
                "2"
            ],
            "time": 0,
            "len": 8,
            "dem": 30
        }
    ],
    "U": [
        {
            "label": "0"
        },
        {
            "label": "6"
        }
    ]
}
